row #,noteID,table #,note applies to,note,noteID PDF,GitHub,myComment
,0,0.0,-,no notes,-,-,-
,,1.0,table,This code table is deprecated. See Common Code table C–0 instead.,no #,n/a,status in github is deprecated
,0,1.1,-,no notes,-,-,-
,0,1.2,-,no notes,-,-,-
,0,1.3,-,no notes,-,-,-
,,1.4,table,An initialized analysis is considered a zero-hour forecast.,no #,n/a,-
,0,1.5,-,no notes,-,-,-
,,1.6,code figure 2,Essentially a non-leap year,comment column,n/a,
,,1.6,code figure 3,Extends the Gregorian calendar indefinitely in the past,comment column,n/a,
,,3.0,code figure 1,Defined by originating centre,comment column,comment column,
,,3.1,code figure 0,"Also called equidistant cylindrical, or Plate Carrée",comment column,comment column,
,,3.1,code figure 20,Can be south or north,comment column,comment column,
,,3.1,code figure 30,"Can be secant or tangent, conical or bipolar",comment column,comment column,
,,3.2,table,WGS-84 is a geodetic system that uses IAG-GRS80 as a basis.,1,na,
,,3.2,table,"With respect to code figures 0, 1, 3, 6 and 7, coordinates can only be unambiguously interpreted, if the coordinate reference system in which they are embedded is known. Therefore, defining the shape of the Earth alone without coordinate system axis origins is ambiguous. Generally, the prime meridian defined in the geodetic system WGS-84 can be safely assumed to be the longitudinal origin. However, because these code figures do not
specify the longitudinal origin explicitly, it is suggested to contact the originating centre if
high precision coordinates are needed, in order to obtain the precise details of the coordinate
system used (effective as from 16 November 2016).",2,na,"applies to code figures 0,1,3,6 and 7"
,0,3.3,-,no notes,-,-,-
,,3.4,table,i direction: west to east along a parallel or left to right along an x-axis.,1,na,
,,3.4,table,"j direction: south to north along a meridian, or bottom to top along a y-axis.",2,na,
,,3.4,table,"If bit number 4 is set, the first row scan is as defined by previous flags.",3,na,
,,3.4,table,"La1 and Lo1 define the first row, which is an odd row.",4,na,
,,3.4,table,"Di and Dj are assumed to be positive, with the direction of i and j being given by bits 1 and 2.",5,na,
,,3.4,table,"Bits 5 through 8 may be used to generate staggered grids, such as Arakawa grids (see Part B, GRIB Attachment II).",6,na,
,,3.4,table,"If any of bits 5, 6, 7 or 8 are set, Di and Dj are not optional.",7,na,
,0,3.5,-,no notes,-,-,-
,,3.6,code figure 1,(see separate doc or pdf file),-,(Code table 3.6),pdf has image of complex formula that can't go in CSV
,,3.7,table,"Values of N(m) for common truncation cases:
Triangular: M = J = K, N(m) = J
Rhomboidal: K = J + M, N(m) = J + m
Trapezoidal: K = J, K > M, N(m) = J",no #,,
,,3.7,code figure 1,(see separate doc or pdf file),-,(Code table 3.7),pdf has image of complex formula that can't go in CSV
,0,3.8,-,no notes,-,-,-
,0,3.9,-,no notes,-,-,-
,0,3.10,-,no notes,-,-,-
,,3.11,na,"For entry 1, it should be noted that depending on values of extreme (first/last) coordinates,
and regardless of bit-map, effective number of points per row may be less than the number
of points on the current circle.",1,na,add see note 1 to entry 1?
,,3.11,code figure 3,"The value for the constant direction increment Di (or Dx) in the accompanying grid definition
template should be set to all ones (missing).",2,(see Note 2)	,
,,3.15,code figure 103,"Negative values associated to this coordinate will indicate depth below ground surface.
If values are all below surface, use of entry 106 is recommended, with positive coordinate
values instead.",1,(see Note 1)	,
,,3.15,code figure 111,"The Eta vertical coordinate system involves normalizing the pressure at some point on a
specific level by the mean sea-level pressure at that point.",2,(see Note 2)	,
,0,3.20,-,no notes,-,-,-
,0,3.21,-,no notes,-,-,-
,0,3.25,-,no notes,-,-,-
,0,4.0,-,no notes,-,-,-
,,4.1,table,"When a new category is to be added to Code table 4.1 and more than one discipline
applies, the choice of discipline should be made based on the intended use of the product.",no id,na,note is directly under table title
,,4.1.0,na,"Entries 9, 10, 11 and 12 are deprecated.",no id,na,update pdf and github? status = deprecated
,0,4.1.1,-,no notes,-,-,-
,0,4.1.2,-,no notes,-,-,-
,,4.1.3,category 0,"Data are numeric without units, although they might be given quantitative meaning through
a code table defined external to this document. The emphasis is on a displayable “picture” of
some phenomenon, perhaps with certain enhanced features. Generally, each datum is an
unsigned, one octet integer, but some image format products might have another datum
size. The size of a datum is indicated in section 5.",1,(see Note 1),
,,4.1.3,category 1,Data are in specified physical units.,2,(see Note 2),
,0,4.1.4,-,no notes,-,-,-
,0,4.1.10,-,no notes,-,-,-
,,4.2,table,"By convention, the flux sign is positive if downwards.",1,na,note is directly under table title
,,4.2,table,"When a new parameter is to be added to Code table 4.2 and more than one category
applies, the choice of category should be made based on the intended use of the product. The
discipline and category are an important part of any product definition, so it is possible to have the
same parameter name in more than one category. For example, “water temperature” in
discipline 10 (oceanographic products), category 4 (subsurface properties) is used for reporting
water temperature in the ocean or open sea, and is not the same as “water temperature” in
discipline 1 (hydrological products), category 2 (inland water and sediment properties), which is
used for reporting water temperature in freshwater lakes and rivers.",2,na,note is directly under table title
,,4.2.0.0,number 14,Parameter deprecated. See Regulation 92.6.2 and use another parameter instead.,*,*,CHANGE TO NUMBERS
,,4.2.0.0,number 21,"Apparent temperature is the perceived outdoor temperature, caused by a combination of
phenomena, such as air temperature, relative humidity and wind speed.",**,**,CHANGE TO NUMBERS
,,4.2.0.1,number 7,Parameter deprecated. See Regulation 92.6.2 and use another parameter instead.,1,(see Note 1),
,,4.2.0.1,number 8,"Statistical process 1 (Accumulation) does not change units. It is recommended to use
another parameter with “rate” in its name and accumulation in PDT.",3,(see Note 3),
,,4.2.0.1,number 9,"Statistical process 1 (Accumulation) does not change units. It is recommended to use
another parameter with “rate” in its name and accumulation in PDT.",3,(see Note 3),
,,4.2.0.1,number 10,"Statistical process 1 (Accumulation) does not change units. It is recommended to use
another parameter with “rate” in its name and accumulation in PDT.",3,(see Note 3),
,,4.2.0.1,number 12,Parameter deprecated. See Regulation 92.6.2 and use another parameter instead.,1,(see Note 1),
,,4.2.0.1,number 13,"Statistical process 1 (Accumulation) does not change units. It is recommended to use
another parameter with “rate” in its name and accumulation in PDT.",3,(see Note 3),
,,4.2.0.1,number 14,"Statistical process 1 (Accumulation) does not change units. It is recommended to use
another parameter with “rate” in its name and accumulation in PDT.",3,(see Note 3),
,,4.2.0.1,number 15,"Statistical process 1 (Accumulation) does not change units. It is recommended to use
another parameter with “rate” in its name and accumulation in PDT.",3,(see Note 3),
,,4.2.0.1,number 16,"It is recommended to use Snow melt rate instead (discipline 2, category 0, number 41).",7,(see Note 7),
,,4.2.0.1,number 27,Parameter deprecated. See Regulation 92.6.2 and use another parameter instead.,1,(see Note 1),
,,4.2.0.1,number 28,Parameter deprecated. See Regulation 92.6.2 and use another parameter instead.,1,(see Note 1),
,,4.2.0.1,29,"Statistical process 1 (Accumulation) does not change units. It is recommended to use
another parameter with “rate” in its name and accumulation in PDT.",3,(see Note 3),
,,4.2.0.1,41,"The listed units for this parameter appear to be inappropriate for the potential evaporation
rate. Instead, it is recommended to use parameter 143.",4,(see Note 4),
,,4.2.0.1,47,"Statistical process 1 (Accumulation) does not change units. It is recommended to use
another parameter with “rate” in its name and accumulation in PDT.",3,(see Note 3),
,,4.2.0.1,48,"Statistical process 1 (Accumulation) does not change units. It is recommended to use
another parameter with “rate” in its name and accumulation in PDT.",3,(see Note 3),
,,4.2.0.1,49,"Statistical process 1 (Accumulation) does not change units. It is recommended to use
another parameter with “rate” in its name and accumulation in PDT.",3,(see Note 3),
,,4.2.0.1,50,"Statistical process 1 (Accumulation) does not change units. It is recommended to use
another parameter with “rate” in its name and accumulation in PDT.",3,(see Note 3),
,,4.2.0.1,52,"Total precipitation/snowfall rate stands for the sum of convective and large-scale
precipitation/snowfall rate.",2,(see Note 2),
,,4.2.0.1,53,"Total precipitation/snowfall rate stands for the sum of convective and large-scale
precipitation/snowfall rate.",2,(see Note 2),
,,4.2.0.1,62,It is recommended to use parameter 148.,8,(see Note 8),
,,4.2.0.1,128,"Total solid precipitation includes the sum of all types of solid water, e.g. graupel, snow and
hail.",5,(see Note 5),
,,4.2.0.1,146,"Assuming a cloud containing a bi-modal ice particle distribution, “cloud ice” refers to the
small particle mode, whereas the large mode is usually called “snow”. (“Ice pellets”, in
contrast, may refer to the precipitation of sleet, formed from freezing raindrops or refreezing
(partially) melted snow flakes, or the precipitation of small hail.)",6,(see Note 6),
,,4.2.0.1,148,"Snow evaporation is the accumulated amount of water that has evaporated from snow from
within the snow covered area of a grid-box.",9,(see Note 9),
,,4.2.0.2,21,Parameter deprecated. See Regulation 92.6.2 and use another parameter instead.,*,*,FIX NOTATION
,,4.2.0.2,34,In relation to local coordinate axes at a cell edge.,**,**,FIX NOTATION
,,4.2.0.2,35,In relation to local coordinate axes at a cell edge.,**,**,FIX NOTATION
,,4.2.0.2,36,"This parameter is described in more detail by (a) Lee, S. and I.M. Held, 1993: Baroclinic
wave packets in models and observations. J. Atmos. Sci., 50:1413–1428, (b) Chang, E.K.M.,
1993: Downstream development of baroclinic waves as inferred from regression analysis.
J. Atmos. Sci., 50:2038–2053, (c) Archambault, H.M., D. Keyser and L.F. Bosart, 2010:
Relationships between large-scale regime transitions and major cool-season precipitation
events in the northeastern United States. Mon Wea. Review, 138:3454–3473, and
(d) Zimin, A.V., I. Szunyogh, B.R. Hung and E. Orr, 2006: Extracting envelopes of
nonzonally propagating Rossby wave packets. Mon. Wea. Review, 134:1329–1333.",***,***,FIX NOTATION
,,4.2.0.2,37,Statistical process 1 (Accumulation) does not change units.,****,****,FIX NOTATION
,,4.2.0.2,38,Statistical process 1 (Accumulation) does not change units.,****,****,FIX NOTATION
,,4.2.0.2,47,Surface roughness for heat is a measure of the surface resistance to heat transfer.,1,(see Note 1),FIX NOTATION
,,4.2.0.2,48,Surface roughness for moisture is a measure of the surface resistance to moisture transfer.,2,(see Note 2),FIX NOTATION
,0,4.2.0.3,-,no notes,-,-,-
,,4.2.0.4,0,Parameter deprecated. See Regulation 92.6.2 and use another parameter instead.,*,*,FIX NOTATION
,,4.2.0.4,1,Parameter deprecated. See Regulation 92.6.2 and use another parameter instead.,*,*,FIX NOTATION
,,4.2.0.4,2,Parameter deprecated. See Regulation 92.6.2 and use another parameter instead.,*,*,FIX NOTATION
,,4.2.0.4,50,"The Global Solar UVI is formulated using the International Commission on Illumination (CIE)
reference action spectrum for UV-induced erythema on the human skin (ISO
17166:1999/CIE S 007/E-1998).
It is a measure of the UV radiation that is relevant to and defined for a horizontal surface.
The UVI is a unitless quantity defined by the formula:
𝐼𝐼𝑈𝑈𝑈𝑈 = 𝑘𝑘𝑒𝑒𝑒𝑒 ∙ 􀶱 𝐸𝐸𝜆𝜆
400𝑛𝑛𝑛𝑛
250𝑛𝑛𝑚𝑚
∙ 𝑆𝑆𝑒𝑒𝑒𝑒(𝜆𝜆)𝑑𝑑𝑑𝑑
where 𝐸𝐸𝜆𝜆 is the solar spectral irradiance expressed in W / (m2·nanometre) at wavelength λ
and 𝑑𝑑𝑑𝑑is the wave-length interval used in the summation. 𝑆𝑆𝑒𝑒𝑒𝑒 𝜆𝜆 is the erythema reference
action spectrum, and 𝑘𝑘𝑒𝑒𝑒𝑒 is a constant equal to 40 m2 / W.",**,**,FIX NOTATION
,,4.2.0.4,51,>>>paste error,**,**,FIX NOTATION
,,4.2.0.4,54,Normal flux is on a surface lifted to be normal to sun rays.,1,(see Note 1),FIX NOTATION
,,4.2.0.5,0,Parameter deprecated. See Regulation 92.6.2 and use another parameter instead.,*,*,FIX NOTATION
,,4.2.0.5,1,Parameter deprecated. See Regulation 92.6.2 and use another parameter instead.,*,*,FIX NOTATION
,,4.2.0.5,2,Parameter deprecated. See Regulation 92.6.2 and use another parameter instead.,*,*,FIX NOTATION
,,4.2.0.6,17,Parameter deprecated. Use another parameter in parameter category 1: moisture instead.,*,*,
,,4.2.0.6,18,Parameter deprecated. Use another parameter in parameter category 1: moisture instead.,*,*,
,,4.2.0.6,19,Parameter deprecated. Use another parameter in parameter category 1: moisture instead.,*,*,
,,4.2.0.6,20,Parameter deprecated. Use another parameter in parameter category 1: moisture instead.,*,*,
,,4.2.0.6,23,Parameter deprecated. Use another parameter in parameter category 1: moisture instead.,*,*,
,,4.2.0.6,47,"The sum of the water and ice fractions may exceed the total due to overlap between the
volumes containing ice and those containing liquid water.",**,**,
,,4.2.0.6,48,"The sum of the water and ice fractions may exceed the total due to overlap between the
volumes containing ice and those containing liquid water.",**,**,
,,4.2.0.6,49,"The sum of the water and ice fractions may exceed the total due to overlap between the
volumes containing ice and those containing liquid water.",**,**,
,,4.2.0.6,50,Fog is defined as cloud cover in the lowest model level.,1,(see Note 1),
,0,4.2.0.7,-,no notes,-,-,-
,,4.2.0.13,table,"This category is no longer populated, please use ""Product discipline 0 – Meteorological
products, parameter category 20: atmospheric chemical constituents.",no number,na,"under title, before table"
,0,4.2.0.14,-,no notes,-,-,-
,0,4.2.0.15,-,no notes,-,-,-
,,4.2.0.16,table,"Decibel (dB) is a logarithmic measure of the relative power, or of the relative values of two
flux densities, especially of sound intensities and radio and radar power densities. In radar
meteorology, the logarithmic scale (dBZ) is used for measuring radar reflectivity factor
(obtained from the American Meteorological Society Glossary of Meteorology).",no number,,assign to numbers 4 and 5?
,,4.2.0.17,1,"Definition of LPI after Lynn et al.: Lynn, B. and Y. Yair, 2010: Prediction of lightning flash
density with the WRF model, Adv. Geosci., 23:11–16; Yair, Y., B. Lynn, C. Price, V. Kotroni,
K. Lagouvardos, E. Morin, A. Mugnai and M. Llasat, 2010: Predicting the potential for
lightning activity in Mediterranean storms based on the Weather Research and Forecasting
(WRF) model dynamic and microphysical fields, Journal of Geophysical Research, 115,
D04205, doi:10.1029/2008JD010868.",1,(see Note 1),
,,4.2.0.17,4,"The total lightning flash density is the sum of cloud-to-ground and cloud-to-cloud lightning
flash densities (see Lopez, P., 2016: A lightning parameterization for the ECMWF Integrated
Forecasting System, Monthly Weather Review, 144, 3057–3075).",2,(see Note 2),
,,4.2.0.18,6,"Statistical process 1 (Accumulation) does not change units. It is recommended to use
another parameter without the word “time-integrated” in its name and accumulation in PDT.",1,(see Note 1),
,,4.2.0.18,7,"Statistical process 1 (Accumulation) does not change units. It is recommended to use
another parameter without the word “time-integrated” in its name and accumulation in PDT.",1,(see Note 1),
,,4.2.0.18,8,"Statistical process 1 (Accumulation) does not change units. It is recommended to use
another parameter without the word “time-integrated” in its name and accumulation in PDT.",1,(see Note 1),
,,4.2.0.18,10,"Conversion factor between “Specific activity concentration” (14) and “Air concentration” (10)
is “mass density” [kg m–3].",2,(see Note 2),
,,4.2.0.18,14,"Conversion factor between “Specific activity concentration” (14) and “Air concentration” (10)
is “mass density” [kg m–3].",2,(see Note 2),
,,4.2.0.18,table,"Parameters from 10 onward may be used in combination with product definition
templates 4.40– 4.43 and Common Code table C–14 (Code table 4.230) to represent any
type of radioisotope.",3,na,add to numbers 10 and up?
,,4.2.0.19,17,Parameter deprecated. See Regulation 92.6.2 and use another parameter instead.,1,(see Note 1),
,,4.2.0.19,23,"Supercooled large droplets (SLD) are defined as those with a diameter greater than
50 microns.",2,(see Note 2),
,,4.2.0.19,30,Eddy dissipation parameter is the third root of eddy dissipation rate [m2 s–3].,3,(see Note 3),
,,4.2.0.19,38,"In astronomy, sky transparency means the effect on the viewing experience caused by the
scattering of light through atmospheric water vapour, aerosols or other constituents. Ideal
transparency conditions produce a black night sky conducive to viewing faint astronomical
objects, almost like being in outer space. In poor transparency conditions, which may occur
even in cloud-free conditions, the deep sky background is greyish (not black), faint details
are washed out and contrast is reduced.",4,(see Note 4),
,,4.2.0.19,39,"Seeing means the steadiness or turbulence of the atmosphere in the context of astronomical
observation. Turbulence causes rapid random fluctuations of the optical path through the
atmosphere. The twinkling of stars, for example, occurs in poor seeing conditions.",5,(see Note 5),
,,4.2.0.20,1,"FirstFixedSurface and SecondFixedSurface of Code table 4.5 (Fixed surface types and units)
to define the vertical extent, i.e. FirstFixedSurface can be set to 1 (Ground or water surface)
and SecondFixedSurface set to 7 (Tropopause) for a restriction to the troposphere.",1,(see Note 1),
,,4.2.0.20,56,"FirstFixedSurface and SecondFixedSurface of Code table 4.5 (Fixed surface types and units)
to define the vertical extent, i.e. FirstFixedSurface can be set to 1 (Ground or water surface)
and SecondFixedSurface set to 7 (Tropopause) for a restriction to the troposphere.",1,(see Note 1),
,,4.2.0.20,58,"FirstFixedSurface and SecondFixedSurface of Code table 4.5 (Fixed surface types and units)
to define the vertical extent, i.e. FirstFixedSurface can be set to 1 (Ground or water surface)
and SecondFixedSurface set to 7 (Tropopause) for a restriction to the troposphere.",1,(see Note 1),
,,4.2.0.20,59,"The term “number density” is used as well for “number concentration” (code number 59);
conversion factor between “number density” (59) and “specific number concentration” (60) is
“mass density” [kg m–3].",2,(see Note 2),
,,4.2.0.20,60,"The term “number density” is used as well for “number concentration” (code number 59);
conversion factor between “number density” (59) and “specific number concentration” (60) is
“mass density” [kg m–3].",2,(see Note 2),
,,4.2.0.20,61,"""FirstFixedSurface and SecondFixedSurface of Code table 4.5 (Fixed surface types and units)
to define the vertical extent, i.e. FirstFixedSurface can be set to 1 (Ground or water surface)
and SecondFixedSurface set to 7 (Tropopause) for a restriction to the troposphere.""",1,(see Note 1),
,0,4.2.0.190,-, no notes,-,-,-
,0,4.2.0.191,-, no notes,-,-,-
,,4.2.1.0,table,"Remotely sensed snow cover is expressed as a field of dimensionless, thematic values. The
currently accepted values are for no-snow/no-cloud, 50, for clouds, 100, and for snow, 250
(see Code table 4.215).",1,na,add to number 2
,,4.2.1.0,table,"A data field representing snow coverage by elevation portrays at which elevations there is
a snow pack. The elevation values typically range from 0 to 90 in 100-metre increments.
A value of 253 is used to represent a no-snow/no-cloud data point. A value of 254 is used to
represent a data point at which snow elevation could not be estimated because of clouds
obscuring the remote sensor (when using aircraft or satellite measurements).",2,na,
,,4.2.1.0,table,"Snow water equivalent per cent of normal is stored in per cent of normal units. For example,
a value of 110 indicates 110 per cent of the normal snow water equivalent for a given depth
of snow.",3,na,add to number 4?
,,4.2.1.0,15,"It is recommended to use Snow melt rate instead (discipline 2, category 0, number 41).",4,(see Note 4),
,0,4.2.1.1,-, no notes,-,-,-
,0,4.2.1.2,-, no notes,-,-,-
,,4.2.2.0,2,"Parameter deprecated. Use another parameter in parameter category 3: soil products
instead.",***,***,
,,4.2.2.0,3,Parameter deprecated. See Regulation 92.6.2 and use another parameter instead.,*,*,
,,4.2.2.0,6,"The listed units for this parameter appear not to be appropriate for evapotranspiration.
Instead, it is recommended to use parameter 39 with statistical process 1 (accumulation) in
order to report evapotranspiration in units of kg m–2.",1,(see Note 1),
,,4.2.2.0,9,"It is recommended not to use this parameter, but another one with a more descriptive unit.",**,**,
,,4.2.2.0,10,Parameter deprecated. See Regulation 92.6.2 and use another parameter instead.,*,*,
,,4.2.2.0,17,Parameter deprecated. See Regulation 92.6.2 and use another parameter instead.,*,*,
,,4.2.2.0,22,"Parameter deprecated. Use another parameter in parameter category 3: soil products
instead.",***,***,
,,4.2.2.0,23,"Parameter deprecated. Use another parameter in parameter category 3: soil products
instead.",***,***,
,,4.2.2.0,33,Statistical process 1 (Accumulation) does not change units.,****,****,
,,4.2.2.0,34,Statistical process 1 (Accumulation) does not change units.,****,****,
,,4.2.2.0,38,"For parameter 38 (Parameter category 0), ice volume is expressed as if the ice content were
melted to liquid water and then its volume measured in the liquid state. This may be
understood in the same manner as water equivalent snow depth.",2,(see Note 2),
,,4.2.2.3,1,Parameter deprecated. See Regulation 92.6.2 and use another parameter instead.,*,*,
,,4.2.2.3,2,Parameter deprecated. See Regulation 92.6.2 and use another parameter instead.,*,*,
,,4.2.2.3,3,Parameter deprecated. See Regulation 92.6.2 and use another parameter instead.,*,*,
,,4.2.2.3,4,Parameter deprecated. See Regulation 92.6.2 and use another parameter instead.,*,*,
,,4.2.2.3,5,"It is recommended not to use this parameter, but another one with a more descriptive unit.",**,**,
,,4.2.2.3,7,"It is recommended not to use this parameter, but another one with a more descriptive unit.",**,**,
,,4.2.2.3,8,"It is recommended not to use this parameter, but another one with a more descriptive unit.",**,**,
,,4.2.2.3,9,"It is recommended not to use this parameter, but another one with a more descriptive unit.",**,**,
,,4.2.2.4,4,"The Fosberg index denotes the potential influence of weather on a wildland fire. It takes into
account the combined effects of temperature, wind speed, relative humidity and
precipitation. Higher values indicate a higher potential impact.",*,*,
,,4.2.2.5,0,A value strictly above 0.5 is treated as glacier. A value equal or below 0.5 is treated as land without glacier.,no number,(see Note),
,0,4.2.3.0,-,no notes,-,-,-
,,4.2.3.1,27,"The ratio of the radiant flux reflected by a surface to that reflected into the same
reflected-beam geometry and wavelength range by an ideal (lossless) and diffuse
(Lambertian) standard surface, irradiated under the same conditions.",1,(see Note 1),
,,4.2.3.1,29,"Top of atmosphere radiance observed by a sensor, multiplied by pi and divided by the
in-band solar irradiance.",2,(see Note 2),
,,4.2.3.2,table,Numbers 31 to 40 are deprecated.,no number,na,
,0,4.2.3.3,-,no notes,-,-,-
,0,4.2.3.4,-,no notes,-,-,-
,,4.2.3.5,0,Theoretical temperature at the precise air-sea interface.,1,(see Note 1),
,,4.2.3.5,1,"Temperature of the water across a very small depth (approximately the upper 20
micrometers).",2,(see Note 2),
,,4.2.3.5,2,Temperature at the base of the thermal skin layer.,3,(see Note 3),
,,4.2.3.5,3,"Temperature of the water column free of diurnal temperature variability or equal to the SST
sub-skin in the absence of any diurnal signal.",4,(see Note 4),
,,4.2.3.6,0,The solar flux per unit area received from a solid angle of 2π sr on a horizontal surface.,1,(see Note 1),
,,4.2.3.6,1,Time integral of global solar irradiance.,2,(see Note 2),
,,4.2.3.6,2,"The solar flux per unit area received from the solid angle of the sun’s disc on a surface
normal to the sun direction.",3,(see Note 3),
,,4.2.3.6,3,Time integral of direct solar irradiance.,4,(see Note 4),
,,4.2.3.6,4,"The solar flux per unit area received from a solid angle of 2π sr, except for the solid angle of
the sun's disc, on a horizontal surface.",5,(see Note 5),
,,4.2.3.6,5,Time integral of diffuse solar irradiance.,6,(see Note 6),
,,4.2.4.0,-,no notes,-,-,-
,,4.2.4.1,-,no notes,-,-,-
,,4.2.4.2,-,no notes,-,-,-
,,4.2.4.3,-,no notes,-,-,-
,,4.2.4.4,-,no notes,-,-,-
,,4.2.4.5,-,no notes,-,-,-
,,4.2.4.6,-,no notes,-,-,-
,,4.2.4.7,-,no notes,-,-,-
,,4.2.4.8,-,no notes,-,-,-
,,4.2.4.9,-,no notes,-,-,-
,,4.2.4.10,-,no notes,-,-,-
,,4.2.10.0,table,"Further information concerning the wave parameters can be found in the Guide to Wave
Analysis and Forecasting (WMO-No. 702).",*,na,
,,4.2.10.1,-,no notes,-,-,-
